lyrics,mood
"[Hook] Show me your gold, do what you're told No time for games, put on your blindfold Show me your gold, do as you're told No time for games, put on your blindfold Show me your gold, do what you're told No time for games, put on your blindfold Show me your gold, do as you're told No time for games, put on your blindfold  [Verse 1] They wanna know, no I can't say no Go to places others wanna blow So here we come, people you don't know Ride the side to the middle of the war Gas, pedal, mine makes metal Feel that heat, let me pour, kettle Roll out like I Skype on bike (Need a glove, white like Mike) One drop, one shop, we Hyde like Jekyll Bust that bullet, and we disabled GPS, we can enable Read about it on your Kindle Rebels will double like a iTunes shuffle Muffle the signal on the drone missile Muzzle ya dogs when I step into the hustle I'm the queen of the east (Now it's time for you to travel) [Hook] Show me your gold, do what you're told No time for games, put on your blindfold Show me your gold, do as you're told No time for games, put on your blindfold  [Outro] Clap, clap your hands your hands can clap Clap, clap your hands your hands can clap Clap, clap your hands your hands can clap Clap, clap your hands your hands can clap Show me your gold, do what you´re told",joy
"[Intro: NORMAN ATOMIC & Budd Dwyer] This a $crim beat Uh, this a $crim beat! My bad, G*59 Oddy Nuff da $now Leopard, $crim DJ $crim with that 808  [Verse 1: NORMAN ATOMIC] ""Slightly overrated"" mean I'm over being rated by cops, critics Cynical assholes that ain't creative My styles jagged, but my attitude seems jaded Like a diamond that shine has really faded From sitting on some chick's finger too long I'm in the basement huffing paintings of animals in cages, uh You ready? I've been waiting Oddy Nuff will leave your body shaking, probably aching Man, fuck a vacation My narration of your duration ends in mutation with starvation and salvation Now, what's the translation? I'm the motherfucking rapping Patrick Bateman Freddy and Jason, spitting campfire Michael Myers, Leatherface with an army of vampires I'm so tired of whack rappers thinking they're fresh When I'm so flyer than a gnat's nest resting in sweat I bet you get the threat Take a deeper breath, and don't forget to motherfuckin' catch it I'll bite a chunk out your neck, take your head and detach it And that's it [Hook: NORMAN ATOMIC] Ain't smoked my weed today Got some hoes and lemonade 7th Ward, West Bank Busting gars, blowing dank  [Verse 2: ANTHONY MARS] It's that junkie that you heard of Snort some dope, then maybe slap a bitch Not talking females, just them rappers on that bag of shit Pimp macking shit Hoe's on that X, and they chewing Used to have that work, just ask any junkie who using Cadillac cruising Abusing some dope That heroin, so soothing With a black bitch who claim Cuban Hail Mary The white 2Pac, rocking some white tube socks No nose ring, just tats, and two Glocks Make a beat with them faders Drop some acid to laugh, while I decapitate you  [Hook: ANTHONY MARS] Ain't smoked my weed today Got some hoes and lemonade 7th Ward, West Bank Busting gars, blowing dank",sadness
"[Chorus: RUBY DA CHERRY] Me and $lick committed seven deadly sins again in the 7th Ward In the 7th Ward Smurf call me up to pick him up whenever he got in the 7th Ward In the 7th Ward I was out of weed and threw a fit I must admit it in the 7th Ward In the 7th Ward Black $uicide, Southside across the lake, we in the 7th Ward In the 7th Ward  [Verse 1: $LICK $LOTH] May Satan bless my enemies You want a verse? It's never free Don't like me? Well, I can agree I only speak in blasphemy Like my bitches watery, drugs up in my arteries Don't give a fuck 'bout loyalty 'cause murders in my pedigree Kill 'em with efficiency, I got no life expectancy Smoking in the first degree, backwoods wrap around my tree I'm everythin' they wanna be, I'm everythin' you're not May all my haters drop, may all you bitches rot [Chorus: RUBY DA CHERRY] Me and $lick committed seven deadly sins again in the 7th Ward In the 7th Ward Smurf call me up to pick him up whenever he got in the 7th Ward In the 7th Ward I was out of weed and threw a fit I must admit it in the 7th Ward In the 7th Ward Black $uicide, Southside across the lake, we in the 7th Ward In the 7th Ward  [Verse 2: Black Smurf] They be like ""Hustle God, can you become a savior, can you save me?"" Hit that feat for my music, it keep 'em crazy Take a cab by any means that's on the daily estate And you started [?] just for safety, mane I wake up and hit that scale out of Memphis Trip back and forth they got lighters smoking me out, zips Know I'm cruisin' with $crim and squad on some mob shit They be alright when I pull up and cut em up quick Nigga  [Chorus: RUBY DA CHERRY] Me and $lick committed seven deadly sins again in the 7th Ward In the 7th Ward Smurf call me up to pick him up whenever he got in the 7th Ward In the 7th Ward I was out of weed and threw a fit I must admit it in the 7th Ward In the 7th Ward Black $uicide, Southside across the lake, we in the 7th Ward In the 7th Ward",anger
"[Gangsta Boo] Million blunts up in my mind, million blunts up in my mind Mask to my fuckin' face, I'm fiendin' to increase my high Million blunts up in my mind, million blunts up in my mind Mask to my fuckin' face, I'm fiendin' to increase my high Million blunts up in my mind, million blunts up in my mind Mask to my fuckin' face, I'm fiendin' to increase my high Million blunts up in my mind, million blunts up in my mind  [Anthony Mars] Walk in with a dead bitch and a Swisher lit Drug kit Got a half hit, worth of acid Can't quit I'm an addict So traumatic and I'm manic Feeling panicked, I need a Xanax Pass it, as I OD, real slowly Lonely looking ghostly surrounded by smoky Mirror images of a fictionist sober me Don't give a fuck 'bout harming me I'm drugging 'til I R.I.P [Gangsta Boo] Mask to my fuckin' face, I'm fiendin' to increase my high Million blunts up in my mind, million blunts up in my mind Mask to my fuckin' face, I'm fiendin' to increase my high Million blunts up in my mind, million blunts up in my mind  [Norman Atomic] Take a hit of acid been a while since I tripped Now I'm seeing all this shit Brain glowing Everything is bending in the same motion Roll the blunt I'll take a hit Start staring at the smoke as it twists and disappears Peer pressure don't affect me bitch I take drugs on my own Pop a Perc and snort some coke It feel like my heart is broke because I get fucked up When I feel alone I'm choking on this 40 of OE I'm hoping that I don't breathe Bitch I'm dope act like you know me Shoot me up so I can OD  [Gangsta Boo] Mask to my fuckin' face, I'm fiendin' to increase my high Million blunts up in my mind, million blunts up in my mind",sadness
"[Verse 1: $LICK $LOTH] Living my life like I die every night Born in the dark, so don't turn on the lights I know that you waiting for me to wake up But you wasting your time because I don't give a fuck Drugs in my vein Got that dope by the gram Paranoid all the time, so the nine's in my hand They know $uicide, I ain't gotta say a fucking thing Catch me on the other side where the mockingbird sings  [Verse 2: LIL OOZING] Hand out the grave no, bitch, it ain't a wave Give me some help, I been dying for days Slittin' myself, bitch, I been dripping yep Melting away, no more need for a belt Hiding my eyes, but they never stay closed I need that belt again, it's for my throat Light up the blunt, bitch, I want to breathe smoke Haunting me, yeah, I'm surrounded by ghosts",fear
"[Verse 1: $LICK $LOTH] Bitch, I'm Gucci Diamonds in my UZI Flipping groupies $uicide's so gloomy (uh-uh) Oh my gosh, smoke and xan, drugs up in my den (den) Back before I used to trap, yen up in a Benz Triple six, got your bitch sucking dick Pulling tricks for that guap Then she shows you what she's taught (uh-uh) Beta-blocker with the choppa' 47 yoppa's I do it for your daughter, and she does it for the dollar  [Verse 2: RUBY DA CHERRY] Bitch, I'm soaking wet, soaking in that Lower Coast Yeah, bitch, I've got that ocean flex Slow motion sex Took your bitch now she my poking pet Are y'all open yet? No bitch, we stay closed Don't you know that yet? Stole that 'Vette, chose that jet (uh-uh) Throw that set Pour that next Squeeze my loaded TEC (uh-uh) I can see you fucking broke a sweat Keep that throat in check You might end up with a broken neck Chosen, 'cause I'm the Frozen Shogun Here, bitch, you can hold my check",sadness
"[Intro: Budd Dwyer] DJ $crim with that 808  [Verse 1: NORMAN ATOMIC] Motherfucker, pass the buck Or should I say bucks? I could give a fuck about ifs, ands, or buts You still getting cut because this is a team, and you not with us We summing up funds, we funding our sums To you this is work, to me this fun Atilla the Hun, dread what we become We chewin' up CEOs, spittin' out bums We never stuck in a rut, Norman Atomic is pissing that mud Ridin' clean in the muck, diamonds gleaming in my semen Get the meaning? Now she screaming, ""put yo' seed in my gut!"" I'm like, ""slut, you fucking nuts—you best believe I'm about bust"" Get on your knees and please just suck What? You got a problem with it? Well, I could give a fuck I'm finna pluck you like a flower petal Drop you back down to that bottom level [Verse 2: ANTHONY MARS] My ambitions as a rider, I'm a shotta bumping 'Pac and Biggie Gimmie the loot, gimmie the loot Or you can meet this semi (grrah!) Listening to Em while I'm smoking and I'm popping pillies Switch it to Weezy, sipping sleazy, thinking about a milli' (woo!) This that dirty south, cracker, junkie that you heard of Pill popping, armed robber, always talking slurred up (what?) Chopped and screwed, sippin' juice, fucking love that syrup (woo) Sick fuck, psycho goonies, no, them meds won't cure us This New Orleans, killers lurking, maybe rob a tourist Lord, forgive me if I'm slippin' and them haters burn us I just don't know no other way, $crimmy always fucked up Yeah, yeah, yeah",anger
"[Intro: Halloween (1978)] Blank, pale, emotionless face, and the blackest eyes, the Devil's eyes  [Verse 1: RUBY DA CHERRY] Bitch, I'm fucking vacant Probably couldn't make it True I got a pillow and a blanket But I'm always sleeping naked I won't get it but I take it Bread crumbs busted I be flaking Flicking ashes off the grass And flick them on the grass I'm lacing up my laces facing public faces 'Cause I'm facing blunts in fucking basements Who said we were racing? Last I checked I'm blazing Bitch, I'm blazing, bitch I'm burning up Got a cup full of flames, got a list of names Pour another up Every sip I drain send them to the grave Gotta golden touch Another soul to gain Look at the ways fuck a stain Nothing was the fucking same Bitch, I'm blowing up [Verse 2: $CRIM] Everybody know the drugs on me One terabyte in my USB Picture perfect with the image like I'm Warhol Horns on my head looking like a narwhal White tenants never laced hunnid blunts to the face Hair ties see the death in my eyes Swear I die every time I get high No cash just two pistols and a mask Riding 'round the city draped in a Soulja rag (Riding, riding, round the city draped in a Soulja rag, riding round)  [Verse 3: Black Smurf] Still scoping moving with my eyes open Never will I lose focus Dope smoke had my mind open Taking on some more shit Hopefully green Dope pulling my knees Though I fiend (?) On the recipe to get it quick And fail (?) I be moving trees up to my (?) Lead bullet, I'mma hustle see I ain't time to wait, too many people (?) (?) I ain't switched the (?) And I ain't got more cash on me (?)  all I",sadness
"Lyrics from Snippet  [Verse: Ugly God] Fuck ya wave, I might sink yo ship Sell your bitch on backpage, like a pimp Momma ain't raise no bitch She ain't raise no wimp Pockets fat, I walk with a limp Talking down, bitch I'll leave you with a slimp I ain't gonna stop until my name across a Blimp Nigga you a bitch, you a wimp Can't fuck with these niggas, these niggas be simp Nigga you a hoe, I fuck on your hoe She suck on my toes I'm with my vro, I'm talking about your clothes Mad like a [?], bitch you don't know I go to the store, buy [?] ayy White like snow, she white like snow, she whiter than snow, ayy Pull up with the stick, pull up with the dick I [?] and fuck on your bitch All of my niggas they be with the shit Talk that shit boy yo' ass will get hit Look at my wrist, look at my neck Look at my chest, bitch you upset I know you wet, I know you wet I know you wet like a lake, yuh Fuck your bitch, she call it right I take your bitch on a date I Milly Rock like I'm [?] Look at my bitch, bitch (Ayy) [Verse: Ski Mask the Slump God] Ayy, ayy Ayy, ayy, ayy I'm like water! I'm like Stoop, yeah, how I cum on top your boo, ooh I have the forbidden fruit, ooh That mean that I got the fucking wisdom to kill the pussy like OJ and Simpson Bitch I'm loose like I drink some Goose [?] duce, huh I forgot that I'm Jason [?] in a mother fucking Huh uh, huh uh, you was a fruit Huh uh, huh uh, bitch better have my loot (Ayy) Huh uh, huh uh, me and my diamonds be like juice Huh uh, huh uh, pull up on a nigga that is a [?] (Look at it, Look at it)",sadness
"[VERSE I: RUBY DA CHERRY] Hunnid spokes on the fucking hearse Bitch I'm cursed Riding around with a can full of gas and a match and a mask Then we stop at the Church Lighting the front of the blunt now I'm burnt Got that work in my trunk Yeah, that's that bump that you heard That pussy boy purred when I popped him in the head Got blood on my shirt Yung Plague is the worst Pulling up on a curb And then snatch me a purse And the bitch carrying it When she ever gonna learn? Bitch I’m trying to swerve Something like I got no limbs Flowing with the dirt Middle finger up Fuck the herd [VERSE II: $LICK $LOTH] Shut the fuck up, bitch Let me blow down on this Indo It's that scarecrow riding solo Blood dripping down my polo It's that dynamite tossing Sleep up in a coffin Jeffrey Dahmer with Alzheimer's Zombies marching right behind us Creeping, creeping with the hatchet All my hoes is ratchet Smoking blunts but ain't no passing Smoking bowls but ain't no packing Middle finger macking, dead bodies keep on stacking Hickory, Dickory, Dock Pulling out my Glock Pull the triggers, bodies drop Like ""pop, pop, pop, pop!""",anger
"[Hook: NORMAN ATOMIC] I get a bag then I blow it Ruby got them bitches locin' Got these bitches deep throatin' In another world Bitch I'm fucking foreign Drugged out so I'm snoring That marijuana got me loaded All these pills that I be throwing In another world Bitch I'm fucking foreign  [Verse 1: NORMAN ATOMIC] Bitch I'm throwing back a 40 Throwing up on a shorty Bitch you know I'm fucking dirty Looking for a bag I need a 30 Pop a molly, bitch I'll pop a shot Watch his head pop and then his body drop Bitch I'm smoking on a blunt Hit her from the back and send her out the fucking front [Hook: ANTHONY MARS] I get a bag then I blow it Scrimmy got them bitches locin' Got them bitches deep throatin' In another world Bitch I'm fucking foreign Drugged out so I'm snoring That marijuana got me loaded All these pills that I be throwing In another world Bitch I'm fucking foreign  [Verse 2: ANTHONY MARS] I'm cooking up and I'm whipping Sippin' on that Bart Simpson Got them drugs wherever I go $crimmy got them hoes retardo I'm in that Ford and I'm screeching Fucking freaks and I be geeking You can see her pussy leaking Every time I get to speaking",anger
"[Verse 1: NORMAN ATOMIC] I'm the colonel of the motherfucking tank Got a mattress, no need for a bank Yeah, I see you motherfucker, but my stare is fucking blank Last night three motherfuckers thought that they were gettin' paid Tried to rob me blind, so I cut open their eyes Left their blood on my blade Now I'm sipping lemonade in the shade Just another day in the 7th Ward by the lake Yeah, bitch, where I stay I be riding in that camo Jeep, double cup is ocean deep I'm sleeping, don't you make a peep Y'all a bunch of fucking cheapened sheep I'll fucking cut and gut your fucking seeping slut And I'm a fucking mutt, I'll sell your meat for bucks  [Verse 2: ANTHONY MARS] Got a bitch that will get your ass done up Hot in the winter and cold in the summer Pussies wanna try to come and run up Glock cocked and I'm chilling with my gun up See I, never gave a fuck about nothing Got crack in the stove, hide the money in the oven If I'm ever trying to get my funds up Break in with the mask, grab the money real fast I hope a fucker know when they see me Never in my life ever sold a CD Lo-fi pimp, mp3, black and white life, no TV Smoking that dope on the low, got all them pounds in the floor Drugs never slow 'cause this that junkie who can flow It ain't, nothing to rob me a liquor store Syrup, I'm drinking it by the four The devil be all up in my soul, bitch [Outro: Point Blank] South Park Said I'm 'bout to lose my mind South Park South Park Said I'm 'bout to lose my mind South Park South Park Said I'm 'bout to lose my mind South Park South Park Said I'm 'bout to lose my mind South Park",sadness
"Are there any, ugly girls in the audience tonight? (Howling and yelling) Umm This is for all the ugly girls in the audience tonight (X4) I hope you... yeah, you... you, ugly bitch Cause this is for all the ugly girls in the audience tonight And this is for the ugly girls, ugly!",sadness
"[Intro] Young Ugly God, bruh Bitches on me, you already know everywhere I go I go to the bathroom, cafeteria, when I sleep Everywhere I go, bitches always on me, nigga  [Hook] I make straight A's, but these hoes on my D Booty from a distance, bitch you know I'm trynna see Ion' give a fuck, I take yo' bitch like a G Young Ugly God, nigga, bitches on me Bitches on me Bitches on me Bitches on me Bitches on me I make straight A's, but these hoes on my D Young Ugly God, nigga, bitches on me  [Verse] Ugly God, giddyup like he on a saddle Young Ugly God, finesse the milk out yo' cattle No food and ass whoopings, you know what I came from Bring that ass here, I squeeze yo' booty like a paint gun Hoes cheer me on, bitch I think I am the mascot Bitches on me, I feel like I just hit the jackpot Ya' better watch ya' girl 'cuz I'll strike her like a match box Ugly God, turn yo' bitch on like a laptop Bitch I am a veteran I look like Thomas Edison Everywhere I go, people treat me like the president Booty Gang, Little Dick Clique, is what I represent Bitch, I got hoes from Argentina to the Netherlands [Bridge] When I see hoes, I pick 'em out like a afro Ugly God, dick game hard like a flagpole Dick real tiny, but she wetter than a tadpole Bitch, I took yo' bitch, I'm a goddamn asshole  [Hook] I make straight A's, but these hoes on my D Booty from a distance, bitch you know I'm trynna see Ion' give a fuck, I take yo' bitch like a G Young Ugly God, nigga, bitches on me Bitches on me Bitches on me Bitches on me Bitches on me I make straight A's, but these hoes on my D Young Ugly God, nigga, bitches on me",sadness
"I’m a suicide boy I be on that grind People always asking if I be alright From Behind,  they don’t always treat me too kind Oh Oh Oh  Always tryna put their pressures on me Like it can be done so easily It would be so easy just to flee Think of that feasibility  I don’t know who to trust anymore Pressures like torrential rain downpour Feelin’ like morality chipped to the core An existential outroar Out here cryin’ on the floor Maybe it’s just fact I’m just too poor  Too rich to be too poor Like I ain’t never had struggles before I ain’t as strong as God, not Thor I pray to God every night Cuz I’m afraid, I got that fright Next test, next flight Next height, Maybe next time I’ll be high as a kite  But I don’t do drugs Sometimes all you need are the hugs Like a love bug, dog with the chew tug Nah girl I ain’t tryna budge, Just need some love  ANIME SCENE  I’m a suicide boy I be on that grind People always asking if I be alright From Behind,  they don’t always treat me too kind Oh  Don’t know what to say anymore Too nervous, to go onto a dance floor My life needs to change, Never seen a door That would open to the next legend, a lore  But it's not easy to be me I know it's not easy to be you What if me and you saw through The woods, wonders that could be Living happily, ever after Words so kind like a pastor This is life, not yet the rapture  Love so swell it would capture Sittin’ under a big green tree in a pasture  But That’s just a thought It’s too late to be caught Ya man’s not hot He cold Or so the mortician told Death a problem ten-fold   I’m a suicide boy I be on that grind People always asking if I be alright From Behind,  they don’t always treat me too kind Oh Oh Oh  I’m a suicide boy I don’t even know if I have enough to cry Sometimes I wish I could fly high up in the sky Only to drop down and die Like in Icarus It would Just be the two of us Together, with the angel’s feather If you’re a suicide boy everything will be fine Keeps those thoughts out yo mind And one day the words you hear will be kind",joy
"[Verse 1: Notorious B.I.G.] Split the dutches fill it with the skunk we about to Get wicked in the joint uh Notorious is glorious Niggas now who's the mind blower, the weed grower Have you seeing doubles like Noah, the rhyme flower B.I.G. top notch with the Glock check your pockets And your sock it's just the way my pops taught me When you throw the drop check em thoroughly The bastard might spin around and try to bury me And dead niggas don't make no moves When I'm slingin in the hood I don't fake no moves aight Reminiscin on my swingin days When I drove a Caddy and my bitch sported finger waves Yea she had the Gucci boots I had Sarducci suits Oshkosh-begosh Coca-Cola lookin real cute Junior M.A.F.I.A. representin Bucktown Mac-11 cocked back niggas better duck down Face down you know the routine the cream Earrings you know the drama Biggie bring  [2Pac] How should I plead forever thuggin on a quest to get G's Runnin from enemies ever since the days of a seed I'm under pressure the stress will have me drinkin Thinkin niggas after me much too paranoid to blink Wonder why the police don't want to see me stackin G's They after a playa but I won't let em capture me I gotta thank the lord for the weed and the nicotine I can't sleep close my eyes I see wicked deams (deamons) I keep my pistol by my bedside one in the chamber Preoccupied with homocide my life's in danger Rollin down the four-five beware of stangers Hand on my 4-5 that's what the fame does I'm probably wrong but I'll never know it till I'm gone From out the gutter where the jealous motherfuckers roam Pass the weed let that Hennessey get to me Before the penitentiary",fear
[Verse: Ruby Da Cherry] I'll be your peanut butter If you'll be my jelly And together when we mix We'll make one great sandwich  [Chorus] Breakfast! Lunch! And Dinner! Breakfast! Lunch! And Dinner!  [Outro] All-day-long! All-day-long! All-day-long! All-day-long!,joy
"I loved her I wanted to stay In her room, chain-smoking all day  You say your prayers, make your promises I loved her, i wanted to stay  Deadbeat boy, no Deadbeat boy, no No you can't stay with me  Father said I'm gonna be okay Father says i might die today Father said i'm gonna be okay Father says i might die today  But oh, deadbeat boy, deadbeat boy You can't stay with me  Is it my partner's hand That makes you think i'm dumb? That puts you on the run Is it my partner's hand? is it my partner's hand Deadbeat boy deadbeat boy deadbeat boy Get the fuck out of my life Deadbeat boy deadbeat boy Get the fuck outta my life Deadbeat boy deadbeat boy deadbeat boy",love
"Hey we're the kids we're here to set the score We're tired of fucking hiding we won't do it no more Come out of the closet and into the pit Boy on boy contact, you know it's the shit LIMP WRIST  No more bullshit tough attitudes Mimicking daddy will no longer do Challenge the system and challenge yourself And if you're man enough, you got to do it Limp Wrist style LIMP WRIST  That's right kids, we are Limp Wrist",anger
[Verse 1] Now is all I know Now is all I got And I don't know If there will be tomorrow for us  Now is all I care about Now that you are here Now that you're the contents of my heart  [Verse 2] Now you're all I know Now is all I promise And I don't know If there will be a future for us  Now is all I live for Now that you are near And it was best that from the start it was clear  [Pre-Chorus] Loving is not owning We can let it go We can let it go Loving is not owning You can let me go You can let me go  [Chorus] There's a reason Why we love each other now And we don't know if this is forever  There's a reason Why we are together now And we don't care if it's not forever now  [Verse 3] Now is all I think about Now that I am happy And I'm not sure If there will be a future for us  Now is all I offer It's everything I got And I still wish That there will be a tomorrow for us  [Pre-Chorus] Loving is not owning We can let it go We can let it go Loving is not owning You can let me go You can let me go  [Chorus] There's a reason Why we love each other now And we don't know if this is forever  There's a reason Why we are together now And we don't care if it's not forever now  [Pre-Chorus] Loving is not owning We can let it go We can let it go  Loving is not owning You can let me go You can let me go  [Chorus] There's a reason Why we love each other now And we don't know if this is forever There's a reason Why we are together now  There's a reason Why we love each other now And we don't know if this is forever  There's a reason Why we are together now And we don't care if it's not forever now  [Coda] We love each other now,joy
