lyrics,mood
"[Intro: NORMAN ATOMIC] Hold up, po' me up, yes Double the cup just to cut the stress in half Guess who the fuck left After all is said and done, regret the past Best move along, got a long way to go, ayy I don't know, I don't know, I don't know (aye!)  [Verse 1: NORMAN ATOMIC] Shawty, I don't mind, but you're always on my mind Think about you all the time, think about you all the time Where the fuck was I when this relationship dried? I was probably high to realize you left my side I will finally give out and die, finally give out and die I would love it if you bring me flowers, if you come by If you come around  [Chorus: ANTHONY MARS] $uicide been on my mind Pour my heart on the concrete every fucking time Each time you left, it feels like you died Depressed and I don't wanna go on any longer [Verse 2: ANTHONY MARS] Delusions keep me going Illusions keep me hoping Parachute woven from broken down Men are from Mars, but there's nothing but cold Grow up all alone No fam, no home So I do drugs, just to numb up Yeah, I do drugs, when I wanna Back off the Xans, five in the morning Ain't tryna come down Ain't tryna be sober  [Chorus: ANTHONY MARS with NORMAN ATOMIC] $uicide been on my mind Pour my heart on the concrete every fucking time $uicide been on my mind Pour my heart on the concrete every fucking time $uicide been on my mind Pour my heart on the concrete every fucking time $uicide been on my mind Pour my heart on the concrete every fucking time",sadness
"[Intro: Bamiyah] There's a sense of meaning, in the nonsense that you say There's a sense of meaning, in the nonsense that you say Crazy I subliming, as my heart becomes your prey Crazy I subliming, as my heart becomes your prey There's a sense of meaning, in the nonsense that you say There's a sense of meaning, in the nonsense that you say  [Verse 1: LORD OF LONELINESS] Allow me to collect myself, I'm all over the place Put my brain on the shelf, throw me away (Throw me away—!) My hands always hiding my face, never knew why I guess it's 'cause I feel erased, sever new ties I'm best when I feel I'm replaced Get the glue, might have to clean up this mess tonight Black skies, not a star in sight That's why I get scarred from light My demons escape to the place where there's blue skies They leave me behind with no trace, get the noose tied My neck snapped, and my body hangs in the new light The end only comes when it's time [Verse 2: Yung Lowdown] Baby, I've longed to see you Baby, can't think of nothing but you I'm caged in, walls cave in Sinking I, I can't swim Do you think of me when you're fucking him? Do you think of... (Fuck—!) 'Cause it's only you I want I'm hurt, and I can't front Seems like I can't get enough of you ripping me apart You got me broken and on my own, hopin' you call my phone Wait, you're blocked, 'cause I'm trying to move on To be frank, I fell in love with a ho But, I need you",sadness
"[Intro: Krayzie Bone] ($uicide) Murder, murder, mo' murder, mo' murder Murder, mo' murder, mo' murder Murder, mo' murder, mo' murder Murder, mo' murder, mo' murder Murder, mo' murder, mo' murder Murder, mo' murder, mo' murder Murder, mo' murder, mo' murder Murder, mo' murder, mo' murder Murder, mo' murder, mo' murder Murder, mo' murder, mo' murder Murder, mo' murder, mo' murder Murder, mo' murder, mo' murder Murder, mo' mur-  [Verse 1: YUNG $CARECROW] $lickity- $lickity $loth the butcher creepin' through with that mystic style Smokin' on whatever, been a junkie since I was a child Every time I think of death, I start to groan and crack a smile Never gave no fuck about this life—and that's me keepin' it mild Killer gorilla, maniac, put they ashes on my blunt The police keep hollerin', ""where they at?"" Buried them in front the lawn The $carecrow with silent weapons, I pull the trigger and disperse The bodies get dumped in acid, so they have no need of a hearse [Verse 2: YUNG PLAGUE] I'm staring at the window like I'm staring at the television Smoking just to pass the time $lick had died, and Christ has risen Listen to the sixes hissing, tipping crucifixes Missin' pieces in my wrist, it seems I'm sleepin', chest beatin' ceases Ridin' in the Cadillac with cataracts, lungs black and chapped Should have put a cap on those ashes, lackin' in fashion (Fuck—) Getting cashed out, bitch, I'm lackin' You're plastic, recyclable and everlasting, uh  [Outro: Krayzie Bone] Murder, mo' murder, mo' murder Murder, mo' murder, mo' murder Murder, mo' murder, mo' murder",anger
"[Intro: Lana Del Rey] A dark night (Dark, dark) Yayo  [Verse 1: CHARLES LEE RAY] Turn this bitch into Virginia Tech, ayy Got the chopper just to make 'em wet, ayy Dynamite around my vest, ayy We them G*59 terrorists, ayy, ayy Keep throwin' threats, and I'll keep yawning Light my cigarette, you just keep on talking Watch where you tread, please watch where you walking I'm from Vietnam, better known as New Orleans The smell of death is so, so familiar I'm that silhouette, that all black figure Grave-digger, grey killer, Lil Cut Throat Drag 'em to the river, watch his fucking body float  [Bridge: Lana Del Rey] Dark, dark Yayo Dark, dark Yayo [Verse 2: RAINDROP WALKA] Two empty pill bottles, I'm fucking duckin' I can't call my plug no more, oh no—but I'll prolly say fuck it Oh, how I love it, really, it ain't for discussion But the truth ain't that far from it I keep on buggin', like fuck it, I'ma say it Like fuck it, I'ma fuck up Like fuck it, I'm a fuck up, and it's fucked up It's just my dumb luck, it's just my dumb luck You'll never put me down more than I have You'd have been down, and it's more than I have Fake fucking smile with the knife in my back Fake fucking child, bitch, that's just how you act  [Outro: Lana Del Rey] Dark, dark Yayo Dark, dark Yayo",anger
"[Verse 1: Ruby da Cherry] I been itching for a plot, yeah But ain't no waving cannons on my block, no 7th Ward Lord, take a shot, yeah I'ma keep my head down (Don't give a fuck) Switching scripts, they're never in the same spot, yeah Fuck this music shit, I'm itchin' for a plot, yeah Ain't no, ain't no fucking digits on my clock, no I ain't one of y'all, just let me rot, yeah I was just with Peep in London Still feel like I don't exist at all, no Fuck this social gathering I'ma smoke a square out in the fucking hall, yuh They told me watch out for the snakes But they forgot about the plague And the AK and with Lil Remains And the AK and what little remains, what little remains  [Verse 2: Lil Remains] Hold up, hold up, hold up, had to put down the narcotics But I ain't really stopping, Xanny and Suboxone Stay up in my wallet, on the block, catch the Glock Shoes hanging like a cord Not a tour, 7th Ward Magnolia brown, Soulja Slim to the bone Hot boys, prime-time Dotted line, never signed On the drugs, can't doze If I do be exposed, oh no Chopper city, dead bodies Alligators, disembodied Did the crime, not the time Lil jits on the porch grippin' Nines, grippin' Nines Pull that torch, light 'em up (Yuh) Young as twelve, livin' hell Lil Remains, Yung Plague No respect given 'less you steal or you take, ho",joy
"[Verse 1: NORMAN ATOMIC] Barrel full of gasoline, and still, they try matchin' me Plague with the wicked ways, it's back to the rapturing Actually capturing souls in a black canteen Open the cap, and become blackened Back to the back of the 'Lac, flickin' cigarette ash Got a chain made of crack, I smoke diamonds And laugh at y'all strapped with the gat Like I'm actually scared to die Pull the fucking trigger, blah-blah-blah-blah-blah-blah! Back to the back, eyes rollin' back Spent all my racks, spent it on crack Spent it on smack, look where I'm at Ain't going back, ain't going back  [Verse 2: ANTHONY MARS] Got a heart so cold, remember sellin' dope Remember sellin' coke, DEA pulled me over Plain cars, plain clothes, I didn't bend an inch, I'm strictly sticking to the code Few years ago was masked up, robbin' stores Set 'em up on Craigslist, then robbed 'em at the door I'm at the bottom tryna eat, I got no hope, fuck Big Ben's death had my head fucked up I'm poppin' Roxys with the Benzos, chest fucked up (I guess my luck's up...)",anger
"[Verse 1: ROMEO DA BLACK ROSE] Catch me in the back, all black I be that shadow hovering Just like the shallow end bubblin' up with blood and guts I used to be known as the ""Shark Attack"" But now I'm hot, like the cherry on my bitch's blunt wrap 'Cause I am the wave Yung Plague the hurricane I am the wave as I crash on the shore, flooding the trail you paved Move out my way, bitch, I'm making a stain Bleach ain't the way to remove all the grey Hating 'cause I took the wind out your sails Now you dried up and salty, 'cause I am the wave (I was the shipwreck, but then I sank...) Full moon, hope you don't cry wolf High Tide in the Snake's Nest, I'm the mongoose At sunset, you can see the blue sky dilute As I blow another grey cloud, hangin' my noose  [Verse 2: YUNG CHRIST] Fuck do you mean we not running the scene? Took us only one year to be underground kings Straight outta hell with the intent to sell Y'all been doing this shit since the year 2012 Fuck do you mean when you say you don't see us? That grey that surrounds you, created by Jesus But Jesus is me, I'm Yung Christ, I'm that leader Better be careful when threadin' that needle (Word around town, Lil $lick got a murder charge Whipping cop cars, while I'm gone off them Xanny bars...) Don't you fucking reach for life? Bitch, take this knife! Tape his mouth and cut the lights Time for the last rites!",anger
"[Intro] Ooh, ooh, ooh, ooh Ooh, ooh, ooh, ooh  [Chorus: LIL CUT THROAT] Pussy, pussyboy, back up off me 'fore you bleed Pussy, pussyboy, back up off me 'fore you bleed Back up off me 'fore you bleed  [Verse 1: LIL CUT THROAT] I got gorillas that surround me, bitch, I'm Caesar They know what I'm 'bout, that boy out the South Forever I'm grieving Pussy, pussyboy, back up off me 'fore you bleed We them crooks, bitch, I'm takin' what I'm needing Rule number one, I'm never shitting where I'm sleeping Think you the one, but I'm the one that they call Jesus Made masterpieces, left the country, stamped some Visas This now my kingdom, put my flag up then I'm leavin' Rest in pieces [Chorus: LIL OOZING] Fuckboy pull up, fuckboy pull up Fuckboy pull up, fuckboy pull up!  [Verse 2: LIL OOZING] Fuckboy pull up with a pistol gripped, ayy Hold up, lil' bitch, what the fuck you think this is? Ay This ain't a game, we ain't playin', this is pit Those fangs in your throat range, boy, get a grip (Shadow expanding without a cloud in the sky A black spot where the sun once was!) It's that full-mooned, bulletproof goon Looming in a tomb, chewin' up someone's buzz Never releasin' the doves, keep 'em locked up, and let 'em rot Let the whole flock gather in a spot There's a hole marked ""rather end a plot"" flooded with bugs The blood that floods us pools at the root of the crop",sadness
"[Verse 1: Lil Cig] Northside shawty pull up in a drop-top 3 AM with the night backdrop Poppin' on pills like I pop cough drops Multi-millionaire all from my laptop Slob on my knob until your jaw lock Came a long way from rocks in my sock Moonwalk on the block while I'm sipping on Wock' Took a whole year off and we still on top Still the same boy that came from Jeffer Street (From Jeffer Street) Still the best friend that the devil keep (That the devil keep) Always burning up, triple six degrees (Triple six degrees) Lock Scarecrow in Hell and throw away the key, yeah  [Chorus: 40 Blunts, 40 Blunts & Lil Cig] As the years go by Another day closer to death Time is ticking, hurry As the years go by Another day closer to death Time is ticking, hurry As the years go by Another day closer to death Time is ticking, hurry As the years go by [Verse 2: 40 Blunts] All the things that you were gonna do, you never did 'em Now you're wondering how come they never listen whenever you're talking Look who the fuck just walked in Time to clear the air, fuck that, I'll be coughing 'til my coffin And in my coffin, I won't toss and turn Instead, I'll rest, I've earned some sleep Let me dream of sheep, release me into the deep Cover up my head with the sheet As the years go by The same fuck girls will be fucking the same fuck boys As the years go by The same hero you once had has been reduced to a toy As the years go by The drugs used to be fun, now they've become a problem As the years go by Before your life even begun, now it's coming undone  [Outro: Lil Cig & 40 Blunts] Tic-toc, tic-toc Tic-toc, tic-toc Tic-toc, tic-toc Tic-toc, tic-toc",joy
"[Intro: LIL HALF CUT] Fuck everybody  [Verse 1: LIL HALF CUT] Galaxies fall when I'm comin' down, nobody comes around I can't do no right Twenty stories high, holdin' up the sky They wanna say goodbye, I just want better times But I done got replaced I'm on my own and I'm tired Dreams fall like nothing, dead slow, dead Go on without plunging I'm so numb, I'm so numb, have you ever been this low? (Fuck no)  [Verse 2: LIL LONELY] I have realized I wanna rewind my whole life, it seems fine I have realized that I am alone $now Leopard wants to freeze and die Winter breath, wishin' for death in the snow Winter breath, wishin' for death in the snow I am zero, anti-hero Winter death, wishin' for breath— but I choke Whisperin' help but no one is listening Goddammit, my piss, it stings I'm planning on repeating history Repeat it blissfully, revealing misery",sadness
"[Verse 1: Lord of Loneliness] It's lonely at the top All of my enemies have been defeated The crown has been sitting on my head for too long It's starting to give me these legions Don't follow the crowd, the crowd is misleading Stay solo, surrounded by all of my demons Licking my wounds as they deepen Constantly feeding them all of my secrets 007, I got the golden gun, I got the golden I'm busting, open up the door I'm at my breaking point, I cannot take this shit no more I'm ready to fucking explode Open up, knock-knock, here comes the Glock cocked Nine milli, pop-pop-pop, oh, no Making a mess, my aim ain't the best I guess I should clean this all up and go home  [Verse 2: Yung Mane] Percocet, Roxycodone, with some Xanax that I had crushed up in some dust, huh Elevated to another dimension so I got a limp in my strut (Fuck) I do not care to be here or be there In the mean time, it seems that I'm stuck, huh Swerving and crashing, that dying little bastard Yung Christ, you address me as such, what? Crazy little demon, they wave when they see me Face tatted from ear to ear, yeah Northside boy with a Glock sized toy If I cock it there's going to be tears here Manic depressive, when life is in session, I hide in a room that's dark as me Dollar sign, B, and it's still F-T-P, fucking G-R-E-Y 'til I R-I-P",sadness
"[Verse 1: YUNG $CARECROW] Been about a day since I bled in a pine bed Get 'em full of dread when they find out that I’m dead Body full of meds, mislead by a pill head Fucking infrared cocked back, ready for the Feds Triple six, triple six, rockin' an upside-down crucifix Luminous lunatic, shredding the bodies Oh no, I'm not new to this Satanic bitches that fuck for the ritual Spiritual visuals, fuckboys habitual Talkin' that shit, you don’t know, bitch, don’t make me get physical Walking 'round miserable, smoking that medical Shoot up a bag of dope Dependent on chemicals I'm on a pedestal, neck hangin' from a rope $carecrow the skeletal, fuck is acceptable? I have no frontal lobe  [Verse 2: 7TH WARD DRAGON] Bitch, you can never be the 7th Ward Dragon Fuck NOPD and fuck JPPD, all the white flags flappin' Ruby da Cherry, what will he do to me? I can't even imagine Ridin' in a monster truck, AK tucked 47 shots is what the AK pump I be that lakefront punk with a vacant trunk Take some when the bass bump Then I wait for them at the bottom of the pit You'll be comin' out the fucking bottom of my pit, that's pitbull shit Red blood drippin' off my fucking pitbull's lips Triple the digits of six Six days went by, on the seventh day, I shine 7th Ward diamond minds illuminated by divine signs Painted by my mind's eye, blankets lyin' on a fine dime Bitch, I'm naked and I might die",sadness
"[Verse 1: RUBY DA CHERRY] Hate me or love me, no, I don't care, it's the same thing .45 in your face, have a great day *59 be the set, bitch, I stay grey Okay, here I come with the AK Okay, Yung Plague got a blank slate No cake, Yung Plague got a blank plate So grey, Yung Plague gotta break banks No pain, but I numb myself anyway Renegade, gotta get away, so I levitate The human race gotta find a way to renovate Keep it simple, bitch, I think I'm fucking Hemingway Gotta find a bitch that I can penetrate Let her know I ain't gonna inseminate Separate, then tell her to go meditate She got depressed and overdosed, now all she do is vegetate  [Verse 2: $LICK $LOTH] Okay, hold up, run up in the spot, this a stick-up Tie the bitch up, time to re-up Hit 'em with the onomatopoeia When I speak up, bitch, I'm Jesus out the freezer 'Cause I'm fucking cold, dead Better yet a threat, to any motherfucker comin' at the fucking set (The $carecrow!) Made out of roaches and locusts Smokers who make waves like Moses, no motive Fucking some co-eds that think I'm a poet But fuck it, I pour it 'till I'm slumped and loaded Reaching my lowest, they think I'm heroic Funny to me, but they think that I'm chosen Illusions, illusions pollutin' the humans One bullet away from my problem's solutions Sippin' on Houston while I rot and ruin Almighty *59, bitch, I'd die for my union",sadness
"[Intro] Beat Fiends  [Hook] Pop, pop, pop that molly Blow indo, blow indo Pop, pop, pop that molly Blow indo, blow indo Pop, pop, pop that molly Blow indo, blow indo Pop, pop, pop that molly Blow indo, blow indo  [Verse 1: YUNG PLAGUE] Uh, double up the cup, I think I'm overflowin' (Beat Fiends) Ocean loaded Ashing gold, I'm fucking sold The devil stole my fuckin' soul, yet I'm still cold Hell froze, $now Leopard hoe repeller Turn a blizzard into fuckin' Armageddon, uh Engine revvin', 7 wars up in the 7th Ward, but I'm number 11, yuh Attention getter, ayy Grey Beretta, ayy Slain ya' whole gang in the motherfucking cellar, ayy Κλείσε την πόρτα, then I penetrate your γυναίκα The demon ingester, I swerve off and total my Tesla [Verse 2: YUNG CHRIST] Pop the trunk, watch me flex Shoot a motherfucker with the AK next Rather now than later, 'cause I wanna meet death Can't scare a motherfucker, even if you got lead Flies chomp, welcome to the feast Hit I-12, grab Ruby from the East Snort a bag of dope, shoot the rest in my feet Gold on my teeth, it's the beast off the leash Fuck, sheesh! R.I.P Any motherfucker wanna come and try me? Six blades, six bullets have you six feet deep ""$carecrow, $carecrow, man, you starting to scare me!"" Fuck you Bitch, I'm from the levees Where the water ain't steady, ridin' 20's on a Chevy, ah, ah Shake all the leaves when my feet hit the ground I see that you pussy, boy, don't make a sound  [Hook] Pop, pop, pop that molly Blow indo, blow indo Pop, pop, pop that molly Blow indo, blow indo Pop, pop, pop that molly Blow indo, blow indo Pop, pop, pop that molly Blow indo, blow indo",anger
"[Intro: Vancouver Sleep Clinic] Stakes, washed away, washed away I'm burning down  [Verse 1: RUBY DA CHERRY] Roll up, and I light a fucking match to the gas, no gas mask Make it splash, and all of a sudden, I'm getting ashes Lasting more than I can fathom Mass appeal is real it seems, mass didn't appeal to me Six-six-six, wrists glisten 'cause of slits Heads missing, so I split Driven apathy, actually traffic No tragic car accidents happen You're just a fucking blip It only matters 'cause we're matter scatterin' around a hole that gets blacker  [Bridge: Vancouver Sleep Clinic, YUNG CHRIST] Stakes, washed away, washed away I'm burning down Stakes, washed away, washed away Hold up before I blow up Hold up before- I'm burning down [Verse 2: YUNG CHRIST, RUBY DA CHERRY] Hold up before I blow up Give me one more time, I can pour up Got the wheels spinnin', but my blood's thinning Oddy telling me that it's time to quit it—but I can't, I'll faint Just one little taste real quick, so I get straight I'm so in debt with this shit, I can't pay I'm so in love with this shit, I can't think, mind gone blank I just keep sinking, ducked out, sleeping These drugs my weakness Seek this money, wrist keep bleeding (Ooh—) And it's seeming that the death of me is gonna be these demons  [Chorus: RUBY DA CHERRY & Vancouver Sleep Clinic] Sold my soul to Satan waiting in line at the mall Stakes, washed away, washed away I got six phones, I got six homes I got a grave six feet tall I'm burning down Stakes— What do I know? Failed chemistry —washed away, washed away Hated religion, fuck it all I'm burning down [Outro: Vancouver Sleep Clinic] Stakes, washed away, washed away I'm burning down",sadness
"[Intro: YUNG $CARECROW & The X Files] I am known What, what, what, what, what, what—? I want to believe...  [Verse 1: YUNG $CARECROW] Bitchboy, back up off me before you catch these hands You in the pit? Don't give a shit, and off a couple tabs Extend my fist and bust his lip, fuck no, I can't relax Put on my mask and rob the trap, just so I can relapse Comin' to end your fucking life! Straight out the fire to terrorize Look in my eyes, this yo' demise, fuckboy's gonna die! Straight out the wild, bound for the mile $lick the mortified, that devilish child with a crooked-ass smile Welcome to the night!  [Break: The X Files] I want to believe...  [Verse 2: SHAWTY BURN-A-CHURCH] Grey blade, grey camo rag wrapped around my face Yung Plague dodgin' ammo, animal instinct to erase Dragon ashing blunts in my fucking talons Grab 'em, drag 'em to the fire, let 'em burn up We ignite 'em—! Plague robbing graves, lace blunts with fuckboy brains! Plague up in flames, let the ash rain, ash king reigns Plague so fucking insane! Don't touch my fucking lane Don't brush my fucking mane Go tuck your fucking chain [Outro: The X Files] I want to believe...",fear
"[Intro: The Antichrist End of the World] ""And he will destroy to an extraordinary degree and prosper and perform his will, and he's seen as a sign of the times"" ""We are living in apocalyptic times. Global warming and a rising nuclear threat among nations that really scare us—the whole middle east, Quagmire, and Jihad, and all of these kinds of things, these are not easy times to live in""  [Verse 1: YUNG PLAGUE] Rip out a piece of my rib and give it to a bitch As the snake whispers to her, ""Ruby does not fucking exist"" So I bit off it's head, then I chewed it, and spit it out Fell to the ground, as I puked up and flipped around Scales started forming, I think that now I am the snake I am the one they call Plague Who will never escape, will forever remain The Omega, the Alpha, the chosen one sent here to reign Who saves all the slaves? Lil Plague breaking chains Jesus Christ was never raised from the dead, he rots away Burn a church and watch the flames, autumn embers turn to grey Wooden crosses in decay, the flock of sheep now fucking slain  [Break: South Park] ""Thanks, Tom. Police are requesting that if you see this little eight-year-old boy, you immediately kill him and burn his body—that's all for now."" [Verse 2: LIL REMAINS] Run up with the motherfucking MAC on attack Shoot back, gat gat, grrra!—he flat Leave them bodies where they lay, let they mothers cry and pray Nina, nina, oh nina, I need you bad up in my life Them heathens that scheming, they breathin' Look dead or somethin' like demons, woah Smash a forty ounce on the cop cars Prolly just popped 'bout five bars, sippin' hydro, got a bad cough Indica dripping down the cigar It's that dope head, drug fiend Mug mean, lonely Shut the fuck up, y'all annoy me  [Outro: The Antichrist End of the World] ""Many prophecy believers feel the end game has already begun."" ""The focus that the world has now on the rise of the Anti-Christ and the return of Christ, I believe the board is set, and the pieces are about to move.""",anger
"[Intro: Lil Choppa] If you say ""kill 'em"", I said ""I got 'em!"" (Lil Choppa) Lil Murder Yeah, yeah, yeah, yeah  [Verse 1: Lil Choppa] Choppa with choppa stay loaded, bullet shells all on your floor Tryna get higher, Ruby got fire I'm fucked up, he fucked up, whole Grey fucked up You done fucked up Passin' that blunt, boy, you know what's up What's good, my G? Drunk drivin', but it's just codeine Keepin' that heat on my side Welcome to my life everyday, life every night We all gon' die, prolly gon' fry Fuck bein' sober, I stay high, forty ounce got sipped Purple and yellow and red, only drink I mix Big bag of that dope, drip goin' down my throat [Verse 2: ROMEO DA BLACK ROSE] Mmm, got your bitch beside my coffin, yeah, I call her Juliet Told her not to weep, just make sure that you fix my fucking neck I'm out of breath from smoking blunts I'm too fucked up from sippin' Tech Was I kissing on your bitch—or did I kiss the fucking TEC? Paint me a new picture, picture that, I pictured death Now my picture perfect moment stained with pieces of my head Hate all of this bullshit, man, I hate all of this stress Imagine that the more press that we get The closer I can feel my death",anger
