lyrics,mood
"You could have a big dipper    Going up and down all around the bends    You could have a bumper car bumping    This amusement never ends    I wanna be your sledgehammer    Why don't you call my name?    Oh, let me be your sledgehammer    This will be my testimony, yeah, yeah    There's a girl that's been on my mind all the time    Su-su-sudio, oh oh    Now she don't even know my name    But I think she likes me just the same    Su-su-sudio, woh oh    And my girl wants to party all the time    Party all the time, party all the time    My girl wants to party all the time, party all the time    She parties all the time    Say you, say me    Say it for always, that's the way it should be    Say you, say me    Say it together naturally    We're going riding on the freeway of love    Wind's against our back    We're going riding on the freeway of love    In a big Cadillac    That's why you need, ooh    That's why this what you need, I'll give you what you need    Yah, yah, yah, do the Harlem polka, everybody now    Yah, yah, yah, do the Harlem polka    She's got it, yeah baby, she's got it    Well, I'm your Venus, I'm your fire    What's your desire?    Nasty, nasty boys don't mean a thing    Oh, you nasty boys    Nasty, nasty boys don't ever change    Oh, you nasty boys    I like this part    Ooh, rock me Amadeus    Ooh, rock me Amadeus    Ooh, rock me Amadeus, ooh    Shout, shout, let it all out    These are the things I can do without, come on    I'm talking to you, come on    Please papa don't preach, I'm in trouble deep    Papa don't preach, I've been losing sleep    But I've made up my mind I'm keeping my baby    Oh, I'm gonna keep my baby    I'm gonna keep my baby    Keep my baby    Keep my baby    Keep my baby    Hey      ",anger
"When we first met she seemed perfectly normal    I never dreamed she'd make my life so hard    You see, my baby, she started to change    Started lookin' kinda strange    Wearin' all that white makeup and those black leotards    Well, I guess she kept her little secret pretty well    Now, ever since I learned the horrible truth, you know my life has been a  living hell    That's right, you see...        She never told me she was a mime    She never told me she was a mime, oh no    Actin' like she's trapped inside a big glass box all the time    She never told me, she never told me whe was a...    Ma-ma-ma-ma-ma-ma-ma-ma-ma-ma-ma-ma-ma-mime        I wish we both could just talk it all over    But my baby won't even make a sound    Now she makes everybody sick    Doin' that pantomime shtick    Even our old friends have stopped coming around    Well, mmy parents can't stand her and our neighbors hate her guts    She's really, really embarrassing me... this silent treatment's driving me  nuts    You see...        She never told me she was a mime    She never told me she was a mime, oh no    Now she's actin' like she's trapped inside a big glass box all the time...  what a crime    She never told me (she never told me) she never told me she was a mime        She walks against the wind everywhere we go    Stops at every corner, gotta put on a show    Carries 'round a picture of Marcel Marceau    Always the wuiet type, but how was I know to know?        She never told me she was a mime    She never told me she was a mime, oh no    Actin' like she's trapped inside a big glass box all the ti-yi-yi-yi-yi-yi-  yime    She never told me, she never told me whe was a mime    ",fear
"Since you've been gone    Well, I feel like I've been chewing on tinfoil    Since you've been gone    It's like I got a great big mouthful of cod liver oil    Oh well, I'm feelin' like I stuck my hand    Inside a blender and turned it on    You know, I've been in a butt load of pain    Since you've been gone    (Since you've been gone)    I couldn't feel any worse if you dropped    A two-ton bowling ball on my toes    (Since you've been gone)    It couldn't hurt anymore if you shoved    A red-hot cactus up my nose        Since you've been gone    Well, it feels like I'm getting tetanus shots every day    Since you've been gone    It's like I've got an ice cream headache that won't go away    Ever since the day you left me    I've been so miserable, my dear    I feel almost as bad as I did    When you were still here    ",sadness
"Had to park my car for just five minutes.    I had to go inside to use the phone.    When I came back again, my car was gone. Well,    I didn't know it was a loading zone.    What a bummer, I is so brought down.    I had to chase that tow truck a over town, yellin'        Stop draggin' my    Stop draggin' my    Stop draggin' my car around.        Took my baby to the local disco.    I was jumpin' like a maniac.    But the owner came and pulled me off the floor. Then    He took me to his little office in the back.    He said, ""I really like your snaggletooth necklace.    Your pants are groovy, and your hair's okay.    But, man, that car of yours is so uncool.    Like wow, I'm sorry, but we towed it away!""        Stop draggin' my    Stop draggin' my    Stop draggin' my car around!        Now I'm at home. I'm watchin' ""Gilligan's Island.""    Guess it's time to trade my old car in.    For twenty dollars and my '64 Plymouth,    Maybe I could get a second-hand Schwinn.    Look out the window, there's a    Tow truck in the driveway.    I grabbed the driver and I asked him why.    He said, ""I'm sorry, kid, you're late with the payments.    It's time to kiss your little car goodbye.""        Stop draggin' my    Stop draggin' my    Stop draggin' my car around!    Stop draggin' my car around!        Listen, the check's in the mail. No, really!    Stop draggin' my car around!    Oh man, I just had the hub caps painted!    Stop draggin' my car around!    Hey! Hey, I left a sandwich in the back seat!    ",anger
"I got my alligator boots I wear my pants skin tight    I wear my dark sunglasses in the middle of the night    And when I look in the mirror I'm-a such an awesome sight    It makes me wanna kneel down and pray    I'm so adorable and charming I'm sure that you can see    And everyone's always trying to hang around with me    They tell me I'm the greatest and it's hard to disagree    'Cause I'm so perfect in every way    And I'm so cute, I can hardly stand it    And I'm so handsome honey I could just die    I know you'll never be as wonderful as me but at least you can try    'Cause I'm such a groovy guy    Yeah, I'm such a groovy guy    I'm such a groovy guy    Yeah, I'm such a groovy guy    Baby are you in the mood for a little romance?    Well for starters I can pour some chocolate pudding down your pants    And then attach electrodes to your brain and watch you dance    Oh, golly wouldn't that be fun?    Oh and then I might decide to tie you up with dental floss    I'll make you wear a harness and I'll show you who's the boss    Of course if you refuse, well honey it's your loss    I mean, I don't do this with just anyone    So baby, how can you say it's all over?    So how can you tell me goodbye?    So now you tell me that you're leaving me for good    And all I wanna know is why?    I mean after all    I'm really such a groovy guy    Yeah, I'm such a groovy guy    I'm such a groovy guy    Yeah, I'm such a groovy guy    I mean you could do worse!    I'm such a groovy guy    Yeah, I'm such a groovy guy    I'm such a groovy guy    I'm such a groovy guy    I'm such a groovy guy    Yeah, I'm such a groovy guy    I'm such a groovy guy    I'm such a groovy guy    ...      ",joy
"Met this pretty young stewardess on a non-stop flight    She showed me to my seat and it was love at first sight    Now lately I've been flying to all kinds of places    That I never really wanted to go    'Cause I'll do anything just to spend a little time    With the sutest flight attendant I know        You set my ever-lovin' heart on fire, Airline Amy    Tell me I'm your favorite frequent flyer, Airline Amy    Found a little piece of heaven on a 747    And no one else can take me higher than Airline Amy        Every one of our dates is at thirty thousand feet    She always points out the exits to me, she's so sweet    You know she gets me my headphones for free    Refills my coffee cup whenevr I ask    And you gotta admit my baby looks pretty hot    When she's wearin' that oxygen mask        Well well, you set my ever-lovin' heart on fire, Airline Amy    Tell me I'm your favorite frequent flyer, Airline Amy    Found a little piece of heaven on a 747    And no one else can take me higher than Airline Amy        Amy, darlin', don't you know you really drive me nuts    Every time you're handing out those honey roasted peanuts    Airline Amy, this is my new mission    Gotta get you in an upright locked position        Oh yeah, you set my ever-lovin' heart on fire, Airline Amy    Tell me I'm your favorite frequent flyer, Airline Amy    Found a little piece of heaven on a 747    And no one else can take me higher than Airline Amy    Yeah yeah, you set my ever-lovin' heart on fire, Airline Amy    You're the only woman I desire, Airline Amy Found a little piece of heaven on  a 747    And no one else can take me higher    No one else can take me higher    And no one else can take me higher than Airline Amy    ",love
"Riding in the bus down the boulevard    And the place was pretty packed (yeah!)    Couldn't find a seat so I had to stand    With the perverts in the back    It was smelling like a locker room    There was junk all over the floor    We're already packed in like sardines    But we're stopping to pick up more, look out        Another one rides the bus    Another one rides the bus    Another comes on and another comes on    Another one rides the bus    Hey, he's gonna sit by you    Another one rides the bus        There's a suitcase poking me in the ribs    There's an elbow in my ear    There's a smelly old bum standing next to me    Hasn't showered in a year    I think I'm missing a contact lens    I think my wallet's gone    And I think this bus is stopping again    To let a couple more freaks get on look out        Another one rides the bus    Another one rides the bus    Another comes on and another comes on    Another one rides the bus    Hey, he's gonna sit by you    Another one rides the bus        Another one rides the bus    Another one rides the bus    Another one rides the bus ow    Another one rides the bus hey hey    Another one rides the bus hey-ey-ey-ey        The window doesn't open and the fan is broke    And my face is turning blue (yeah)    I haven't been in a crowd like this    Since I went to see the who    Well I should've got off a couple miles ago    But I couldn't get to the door    There isn't any room for me to breathe    And now we're gonna pick up more        Another one rides the bus    Another one rides the bus    Another comes on and another comes on    Another one rides the bus    Hey, he's gonna sit by you    Another one rides the bus    ",sadness
"I used to think my life was so empty    I used to think life was passin' me by    Well, I was just about ready    To curl up and die        But then one day I got a visit    From the cable company    Well, they hooked me up and plugged me right in    And now I got cable TV        And now I get to watch the stock report in Korean    Midget wrestling on channel three    It costs me fifty bucks a month just to see 'em    Yeah, but that's all right with me        I got cable TV (Cable TV)    Cable TV (Cable TV)    Oh, eighty-three channels of ecstasy    I love my cable TV, yeah    I love my cable TV        I got the Siamese Faith Healer's Network    The news and weather from Peru    I got celebrity hockey    The Racketball Channel too        Bugs Bunny direct from Atlanta    Mr. Wizard is on at five    I got a satellite dish on the trunk of my car    So I can watch MTV while I drive        I'm talkin' 'bout real quality programs    The kind you just can't get for free    Now I never want to leave my apartment    'Cause there's just so much for me to see        On my cable TV (Cable TV)    Cable TV(Cable TV)    Well, if you need to find me    You know where I'll be    Watchin' my cable TV, yeah    Watchin' my cable TV        'Cause I love my cable TV, yeah    I love my cable TV        My friends are gettin' kinda worried    They think I'm turning into some kinda freak    Oh, but they're just jealous 'cause I've seen Porky's    Twenty-seven times this week        On my cable TV (Cable TV)    Cable TV (Cable TV)    Yeah, the greatest thing that's ever happened to me    I love my cable TV, yeah    I love my cable TV        Well, I got to have cable TV, yeah    I need my cable TV        Well, I love, I love my cable TV (TV)    Got to have cable TV (TV)    Well, I got to have my cable TV, yeah (TV)    Can't live without my cable TV        Well, I said, got to have some cable TV (TV)    I've got to have my cable TV    I said cable TV, yeah (TV)    Got to have cable TV    ",sadness
It's Christmas at ground zero    There's music in the air    The sleigh bells are ringing and the carolers are singing    While the air raid sirens blare    It's Christmas at ground zero    The button has been pressed    The radio just let us know that this is not a test    Everywhere the atom bombs are dropping    It's the end of all humanity    No more time for last minute shopping    It's time to face your final destiny    It's Christmas at ground zero    There's panic in the crowd    While we dodge debris let's trim the tree    Underneath the mushroom cloud        You might hear some reindeer on your rooftop    Or Jack Frost on your windowsill    But if someone's climbing down your chimney    You better load your gun and shoot to kill    It's Christmas at ground zero    And if the radiation levels OK    I'll go out with you and see all the new    Mutations on New Year's Day    It's Christmas at ground zero    Just seconds left to go    I'll duck and cover with my Yuletide lover    Underneath the mistletoe    It's Christmas at ground zero    Now the missiles are on their way    What a crazy fluke we're gonna get nuked    On this jolly holiday    What a crazy fluke we're gonna get nuked    On this jolly holiday    ,joy
"Once in a while maybe you will feel the urge    To break international copyright law    By downloading M-P-3's from file-sharing sites    Like Morpheus or Grokster or LimeWire or KaZaA    But deep in your heart you know the guilt would drive you mad    And the shame would leave a permanent scar    'Cause you start out stealing songs, and then you're robbing liquor stores    And selling crack and running over school kids with your car        So don't download this song    The record store's where you belong    Go and buy the C-D like you know that you should    Oh don't download this song        Oh you don't want to mess with the are I double A    They'll sue you if you burn that C-D-are    It doesn't matter if you're a grandma or a 7-year-old girl    They'll treat you like the evil, hard-bitten criminal scum you are        So don't download this song    Don't go pirating music all day long    Go and buy the C-D like you know that you should    Oh, don't download this song        Don't take away money from artists just like me    How else can I afford another solid gold Humvee?    And diamond-studded swimming pools, these things don't grow on trees    So all I ask is everybody, please        Don't download this song (Don't do it, no, no)    Even Lars Urlich knows it's wrong (You can just ask him)    Go and buy the C-D like you know that you should (You really should)    Oh, don't download this song        Don't download this song (Oh please don't you do it)    Or you might wind up in jail like Tommy Chong (Remember Tommy)    Go and buy the C-D (Right Now) like you know that you should (Go out and buy  it)    Oh don't download this song        Don't download this song (No no no no no no)    Or you'll burn in Hell before too long (And you'd deserve it)    Go and buy the C-D (Just buy it) like you know that you should (Ya cheap  bastard)    Oh, don't download this song    ",anger
"Fun Zone doesn't really have any lyrics.    People occasionally say ""yeah"" and other similar phrases,    But it's generally just music.        In the movie,    It played in the background    When Stanley rode out in the miniature fire engine    At the beginning of an episode of Stanley Spadowski's Clubhouse.        The song is approximately    1 minute and 45 seconds long,    But it did not play in its entirety in the movie.    ",joy
"There he goes, he drives me crazy    When he says...(Hee-eere's Johnny!)    That's his job, it's so amazing    All he says is...(Hee-eere's Johnny!)    I never miss a moment when he's on the tube    His being there has made my life worth living    The chills run down my spine    Each time he says that line        ""Here's Johnny!"" He says, and laughs in his special way    ""...Johnny!"" he says, you know I love him    ""Here's Johnny!"" he says, and ""second fiddle"" is his game    Ed McMahon's his name...all right        Dressed so fine, he's such a cool dude    Hear him say...(Hee-eere's Johnny!)    Watch him selling beer and dog food    Hear him say...(Hee-eere's Johnny!)    I got a letter from him just the other day    He said, ""You may already be a winner!""    A trooper to the end    A Clydesdale's best friend        ""Here's Johnny!"" he says, and laughs in his special way    ""...Johnny!"" he says, you know I love him    ""Here's Johnny!"" he says, and that's the way he gets his pay    What a living        Oh...(Here's Johnny! Here's Johnny!) Wo-o-o, no    (Here's Johnny! Here's Johnny!) No no no no no no, I don't believe it    (Here's Johnny!) he says, and everytime it's just the same    Ed McMahon's his name        A very special guy...all right    He's on every night    Can't change the channel    When he's sitting on the panel    (Hee-eere's Johnny!)    There he goes, he gives me goose bumps    When he says...(Hey-O-Hey-Hey-O!)        ""Here's Johnny!"" he says, and laughs in his special way    ""...Johnny!"" he says, you know I love him    ""Here's Johnny!"" he says, that seems to be his claim to fame    Ed McMahon's his name      ",joy
"Isn't it strange? Feels like I'm lookin' in the mirror    What would people say if only they knew that I was    Part of some geneticist's plan    Born to be a carbon copy man    There in a petri dish late one night    They took a donor's body cell and fertilized a human egg and so I say        I think I'm a clone now    There's always two of me just a-hangin' around    I think I'm a clone now    'Cause every chromosome is a hand-me-down        Look at the way we go out walking close together    I guess you could say I'm really beside myself    I still remember how it began    They produced a carbon copy man    Born in a science lab late one night    Without a mother or a father    Just a test tube and a womb with a view        I think I'm a clone now    There's always two of me just a-hangin' around    I think I'm a clone now    'Cause every chromosome is a hand-me-down    I think I'm a clone now    And I can stay at home while I'm out of town    I think I'm a clone now    'Cause every pair of genes is a hand-me-down        Signing autographs for my fans    Come and meet the carbon copy man    Livin' in stereo, it's all right    Well I can be my own best friend and I can send myself for pizza, so I say        I think I'm a clone now    Another one of me's always hangin' around    I think I'm a clone now    'Cause every chromosome is a hand-me-down    I think I'm a clone now    I've been on Oprah Winfrey, I'm world renowned    I think I'm a clone now    And every pair of genes is a hand-me-down    I think I'm a clone now    Thats my genetic twin always hangin' around    I think I'm a clone now    'Cause every chromosome is a hand-me-down    ",fear
"I finally made it through med school    Somehow I made it through    I'm just an intern    I still make a mistake or two        I was last in my class    Barely passed at the institute    Now I'm trying to avoid, yah I'm trying to avoid    A malpractice suit        Hey, like a surgeon    Cuttin' for the very first time    Like a surgeon    Organ transplants are my line        Better give me all your gause nurse    This patient's fading fast    Complications have set in    Don't know how long he'll last        Let me see, that I.V.    Here we go time to operate    I'll pull his indsides out, pull his insides out    And see what he ate        Like a surgeon, hey    Cuttin' for the very first time    Like a surgeon    Here's a waiver for you to sign        Woe, woe, woe        It's a fact I'm a quack    The disgrace of the A.M.A.    'Cause my patients die, yah my patients die    Before they can pay        Like a surgeon, hey    Cuttin' for the very first time    Like a surgeon    Got your kidneys on my mind        Like a surgeon, ooh like a surgeon    When I reach inside    With my scalpel, and my forceps, and re-tractors    Oh oh, oh oh, woe, oh        Ooh baby, yeah    I can hear your heartbeat    For the very last time    ",sadness
"Here's a llama    There's a llama    And another little llama    Fuzzy Llama    Funny Llama    Llama Llama duck        Llama llama    Cheesecake llama    Tablet, brick, potato, llama    Llama llama mushroom llama    Llama llama duck        I was once a tree house    I lived in a cake    But I never saw the way    The orange slayed the rake    I was only three years dead    But it told a tale    And now listen little child    To the safety rail        Did you ever see a llama    Kiss a llama    On the llama    Llama's llama    Tastes of llama    Llama llama duck        Half a llama    Twice a llama    Not a llama    Farmer llama    Llama in a car    Alarm a llama    Llama duck        Is that how it's told now    Is it all so old    Is it made of lemon juice    Doorknob, ankle, cold    Now my song is getting thin    I've run out of luck    Time for me to retire now    And become a duck (x6)    ",fear
"I visit Mr. Frump in the hospital    I see him most every day    And when I see Mr. Frump in his iron lung    This is what I hear him say        why'know, Mr. Frump is my very best friend    He's never a chump or a tease    He never tells me lies, and best of all    He never disagrees        I bring him candy and flowers every afternoon    Sit down by his side and say ""Hi""    And then I ask him his opinion of the world situation    And I wait for Mr. Frump's reply, and Mr. Frump would say        Well, unfortunately, soon it came to be    Mr. Frump's dying day    And now I bring to you the very last thing    That Mr. Frump had to say....        (deep breathing, that fades and dies off)        Amen    ",sadness
"I need a vegematic!    I need a pocket fisherman!    I need a handy appliance    That'll scramble an egg while it's still inside its shell!    (Operators are standing by.    How does that make you feel?)    Help me.    Mr. Popeil!        I wanna shine some pennies!    I wanna mend some leather!    I wanna Krazy-glue my head to the bottom of a big steel girder!    (Please, no c.o.d.'s.    Don't miss out on this deal.)    Ah, help me.    Mr. Popeil!        Help me.    Mr. Popeil!    Mr. Popeil!    Mr. Popeil!        (whoa, whoa oh.)    It slices. it dices.    Look at that tomato!    You could even cut a tin can with it,    But you wouldn't want to!        Mr. Popeil, I'm in trouble.    Need your assistance on the double.    Oh no! now how am I gonna make    My old vinyl car top look like new?    Mr. Popeil!    Tell me, what am I s'posed to do?        Mr. Popeil!    Mr. Popeil!        (Now how much would you pay?)    But wait, there's more!    It's not sold in any store!    (Now how much would you pay?)    Don't answer yet,    Just look what else you get!    (Now how much would you pay?)    If you order today,    You get a ginsu knife and a smokeless ashtray!    (Now how much would you pay?)    Now how much would you pay?    Mr. Popeil, Mr. Popeil.    Mr. Popeil, Mr. Popeil.    Mr. Popeil, Mr. Popeil.    Mr. Popeil, Mr. Popeil.        Make me buy a garden weasel!    Make me buy a bamboo steamer!    Make me take advantage    Of this amazing tv offer!    (Call our toll-free number,    We'll make you such a deal.)    Aw, help me!    Mr. Popeil. I want it!    (Mr. Popeil.) well, I need it!    (Mr. Popeil.) I got to got to got to have it!    Mr. Popeil!    Mr. Popeil!    Hey!    ",joy
